{
  "project_name": "demo_game",
  "starter_template": "starter",
  "target_path": "target",
  "scenes_to_create": [
    {
      "path": "scenes/gameplay.tscn",
      "root_type": "Node2D",
      "root_name": "Gameplay",
      "nodes": []
    }
  ],
  "scripts_to_create": [
    {
      "path": "scripts/gameplay/gameplay_controller.gd",
      "role": "controller",
      "scene_owned": true,
      "dependencies": []
    }
  ],
  "systems_to_create": [],
  "ui_to_create": [],
  "config_files_to_create": [],
  "validation_checks": [
    {
      "id": "scene_files_exist",
      "description": "scenes exist"
    }
  ],
  "repair_hints": []
}