{
  "project_name": "MyProject1",
  "starter_template": "./ai-starter-template",
  "target_path": "/Users/ishanharshaddiwekar/Project/GameGen-Conversational-AI-workspace/backend/artifacts/MyProject1/run_002/project",
  "scenes_to_create": [
    {
      "path": "scenes/MainMenu.tscn",
      "root_type": "Control",
      "root_name": "MainMenu",
      "nodes": [
        {
          "name": "TitleLabel",
          "type": "Label",
          "parent": "MainMenu",
          "script_path": ""
        },
        {
          "name": "PlayButton",
          "type": "Button",
          "parent": "MainMenu",
          "script_path": ""
        }
      ]
    },
    {
      "path": "scenes/Gameplay.tscn",
      "root_type": "Node2D",
      "root_name": "Gameplay",
      "nodes": [
        {
          "name": "Player",
          "type": "Node2D",
          "parent": "Gameplay",
          "script_path": "scripts/Player.gd"
        },
        {
          "name": "EnemySpawner",
          "type": "Node2D",
          "parent": "Gameplay",
          "script_path": "scripts/EnemySpawner.gd"
        },
        {
          "name": "HUD",
          "type": "Control",
          "parent": "Gameplay",
          "script_path": ""
        },
        {
          "name": "ScoreManager",
          "type": "Node2D",
          "parent": "Gameplay",
          "script_path": "scripts/ScoreManager.gd"
        },
        {
          "name": "DifficultyScaler",
          "type": "Node2D",
          "parent": "Gameplay",
          "script_path": "scripts/DifficultyScaler.gd"
        }
      ]
    },
    {
      "path": "scenes/FailPopup.tscn",
      "root_type": "Control",
      "root_name": "FailPopup",
      "nodes": [
        {
          "name": "ResultLabel",
          "type": "Label",
          "parent": "FailPopup",
          "script_path": ""
        },
        {
          "name": "RetryButton",
          "type": "Button",
          "parent": "FailPopup",
          "script_path": ""
        },
        {
          "name": "MenuButton",
          "type": "Button",
          "parent": "FailPopup",
          "script_path": ""
        }
      ]
    }
  ],
  "scripts_to_create": [
    {
      "path": "scripts/Player.gd",
      "role": "Player controller",
      "scene_owned": true,
      "dependencies": []
    },
    {
      "path": "scripts/EnemySpawner.gd",
      "role": "Spawns enemy letters",
      "scene_owned": true,
      "dependencies": []
    },
    {
      "path": "scripts/ScoreManager.gd",
      "role": "Tracks survival time",
      "scene_owned": true,
      "dependencies": []
    },
    {
      "path": "scripts/DifficultyScaler.gd",
      "role": "Adjusts spawn rate and speed",
      "scene_owned": true,
      "dependencies": []
    },
    {
      "path": "scripts/EnemyLetter.gd",
      "role": "Enemy letter behavior",
      "scene_owned": true,
      "dependencies": []
    }
  ],
  "systems_to_create": [],
  "ui_to_create": [],
  "config_files_to_create": [],
  "validation_checks": [
    {
      "id": "scene_file_exists",
      "description": "Verify that MainMenu.tscn, Gameplay.tscn, and FailPopup.tscn exist in the scenes folder."
    },
    {
      "id": "script_file_exists",
      "description": "Verify that all listed script files exist in the scripts folder."
    },
    {
      "id": "required_nodes_present",
      "description": "Check that Gameplay scene contains nodes: Player, EnemySpawner, HUD, ScoreManager, DifficultyScaler."
    },
    {
      "id": "player_input_handler",
      "description": "Ensure Player node has a script that connects to InputEvent and processes typed characters."
    },
    {
      "id": "enemy_spawn_logic",
      "description": "Verify EnemySpawner script emits a signal or directly instantiates EnemyLetter nodes."
    },
    {
      "id": "hud_display",
      "description": "Confirm HUD contains a Label node that updates survival time."
    }
  ],
  "repair_hints": [
    "If a scene file is missing, create it with the specified root node type and name.",
    "If a script file is missing, create an empty GDScript file at the specified path.",
    "Ensure that the Player script connects to the InputEvent and checks typed characters against child EnemyLetter nodes.",
    "Add a Timer node to EnemySpawner to control spawn intervals.",
    "Add a Timer or process function in DifficultyScaler to adjust spawn rate over time."
  ]
}